{
  "schemaVersion": 1,
  "deploymentId": "97:0x29f8158114fa56a438a36600e988c4348979aeac",
  "environment": "testnet",
  "createdAtUtc": "2026-09-16T16:08:09Z",
  "notes": "Testnet plan, filled in on 2026-09-16 from values verified against BSC testnet (chain 97). One 1-of-1 Safe created by contracts/script/TestnetSafe.s.sol holds owner, treasury and seed. Feed and coordinator facts were read from the live chain with cast the same day; the p99.9 feed interval comes from scripts/observe_feed.ts over 14 days.",
  "chain": {
    "chainId": 97,
    "name": "bsc-testnet",
    "nativeSymbol": "BNB",
    "explorerUrl": "https://testnet.bscscan.com",
    "confirmationDepth": 200,
    "startBlock": 131396146,
    "rpcEnvVars": {
      "public": "LUCKYDRAW_RPC_URL",
      "operational": "LUCKYDRAW_OPS_RPC_URL"
    }
  },
  "toolchain": {
    "foundry": "1.8.1",
    "solc": "0.8.28",
    "evmVersion": "paris",
    "optimizer": true,
    "optimizerRuns": 600,
    "viaIr": true,
    "bytecodeHash": "none"
  },
  "contracts": {
    "vault": {
      "address": "0x93d7b447311484f485534328822f187c7c22e958",
      "codeHash": "0xb75270ba5311c3263d0c0c9076abd412792a4834a1d945472c6464e5a30e3f9b",
      "deployBlock": 131396146,
      "deployTx": "0x5028759b787d2526e8872430ec188f81be28b652aad1c7d23d3c5090d942a1be",
      "owner": "0xcde8a0e1f0d682771ec8c76da8d2bb89c89d5079",
      "pendingOwner": "0x0000000000000000000000000000000000000000"
    },
    "draw": {
      "address": "0x29f8158114fa56a438a36600e988c4348979aeac",
      "codeHash": "0xafadddf28a1069f8465eae68d9db9a04660fa55d1ef08ea26a158cc10f426f04",
      "deployBlock": 131396147,
      "deployTx": "0xd0249636a8916490903dc9012698a439179a752b89c5b8c47c3c282bacbb1f61",
      "owner": "0xcde8a0e1f0d682771ec8c76da8d2bb89c89d5079",
      "pendingOwner": "0x0000000000000000000000000000000000000000",
      "constructorArgs": {
        "vault": "0x93d7b447311484f485534328822f187c7c22e958",
        "coordinator": "0xda3b641d438362c440ac5458c57e00a712b66700",
        "subscriptionId": "53341058529245420530544866364539679366821500461295078074040108946677515631275",
        "keyHash": "0x8596b430971ac45bdf6088665b9ad8e8630c9d5049ab54b14dff711bee7c0e26",
        "requestConfirmations": 200,
        "callbackGasLimit": 300000,
        "maxRequestCostNative": "40000000000000000",
        "feeAccount": "0xcde8a0e1f0d682771ec8c76da8d2bb89c89d5079",
        "initialOwner": "0xb037a5d43a39fc7a3c7ced56b56d6432478e8753"
      }
    }
  },
  "vrf": {
    "coordinator": "0xda3b641d438362c440ac5458c57e00a712b66700",
    "coordinatorIsMock": false,
    "subscriptionId": "53341058529245420530544866364539679366821500461295078074040108946677515631275",
    "subscriptionOwner": "0x52f62d7b78d5139863ab9503140714c49afdba6b",
    "keyHash": "0x8596b430971ac45bdf6088665b9ad8e8630c9d5049ab54b14dff711bee7c0e26",
    "nativeBilling": true,
    "requestConfirmations": 200,
    "numWords": 2,
    "callbackGasLimit": 300000,
    "maxRequestCostNative": "40000000000000000",
    "maxRequestCostDerivation": {
      "maxGasPriceWei": "50000000000",
      "verificationGasOverhead": 200000,
      "premiumPercentage": 60,
      "flatFeeNativeWei": "0",
      "note": "50 gwei lane (s_provingKeys maxGas = 50000000000 on the coordinator, 2026-09-16) x (300000 callback + 200000 max verification gas from docs.chain.link/vrf/v2-5/billing) x 1.60 (s_config nativePremiumPercentage = 60, fulfillmentFlatFeeNativePPM = 0, read from the coordinator 2026-09-16) = 0.04 BNB."
    },
    "consumerRegistered": true,
    "consumerRegistrationTx": null,
    "keyHashGetter": "s_provingKeys(bytes32)",
    "lowFundingThresholdNative": "40000000000000000",
    "measuredCallbackGasUsed": null,
    "source": {
      "url": "https://docs.chain.link/vrf/v2-5/supported-networks",
      "date": "2026-09-16"
    }
  },
  "ownership": {
    "finalOwner": "0xcde8a0e1f0d682771ec8c76da8d2bb89c89d5079",
    "feeAccount": "0xcde8a0e1f0d682771ec8c76da8d2bb89c89d5079",
    "seedAccount": "0xcde8a0e1f0d682771ec8c76da8d2bb89c89d5079",
    "ownershipAccepted": true,
    "makeWholeReserve": "0",
    "makeWholeCap": "0",
    "note": "Testnet: one 1-of-1 Safe (v1.4.1, owner = the deployer keystore account) holds all three roles. No make-whole reserve on testnet; there is none, and this says so plainly. SPEC section 12.1 allows one operator Safe for owner, treasury and seed on testnet; mainnet requires three separate Safes with 2-of-3 hardware keys (SPEC section 10.5). The final owner must accept both Ownable2Step transfers, and the seed account must call Vault.authorizeSeed itself before any seed entry."
  },
  "assets": [
    {
      "asset": "0x0000000000000000000000000000000000000000",
      "native": true,
      "symbol": "BNB",
      "name": "BNB",
      "decimals": 18,
      "isMock": false,
      "listed": true,
      "depositsEnabled": true,
      "exactTransferEvidence": "Native path: the Vault credits exactly msg.value and checks the exact debit on withdrawal, so no token transfer hook can change the amount (SPEC section 3.1).",
      "status": "candidate",
      "source": {
        "url": "https://docs.bnbchain.org/bnb-smart-chain/",
        "date": "2026-09-16"
      },
      "price": {
        "feed": "0x2514895c72f50d8bd4b4f9b1110f0d6bd2c97526",
        "feedIsMock": false,
        "feedDecimals": 8,
        "baseQuote": "BNB/USD",
        "heartbeatSeconds": 3600,
        "observedP999IntervalSeconds": 3661,
        "maxPriceAge": 7200,
        "minAnswer": "0",
        "maxAnswer": "99999999999999999999999999999",
        "answerBoundsConfirmedAbsent": false,
        "referenceKind": "ExactToken",
        "displayLabel": "BNB/USD",
        "pegAssumption": null,
        "verifiedOn": "2026-09-16",
        "source": {
          "url": "https://docs.chain.link/data-feeds/price-feeds/addresses",
          "date": "2026-09-16"
        },
        "observationWindow": {
          "fromBlock": 128705071,
          "toBlock": 131391899,
          "samples": 689
        }
      },
      "pool": {
        "poolId": "1",
        "enabled": true,
        "seedAmount": "1000000000000000",
        "seedAuthorizedMaxPerRound": "2000000000000000",
        "targetsUsd": {
          "Day100": 100,
          "Day1k": 1000,
          "Day10k": 10000,
          "Week1k": 1000,
          "Week10k": 10000,
          "Week100k": 100000,
          "Month100k": 100000
        },
        "firstRoundIds": [
          "1",
          "2",
          "3",
          "4",
          "5",
          "6",
          "7"
        ]
      }
    }
  ],
  "mocks": []
}
